# Notes

_All published notes can be found below_

- [FAB Notes](#fab-notes)
- [UsersGroup Notes](#users-group-notes) (incl. Pilot Group)

## FAB Notes

- [Notes 04-11-2020](2020-11-04-notes-FAB-session-1.md)
- [Notes 18-11-2020](2020-11-18-FAB-notes.md)
- [Notes 02-12-2020](2020-12-02-FAB-notes.md)
- [Notes 16-12-2020](2020-12-16-FAB-notes.md)
- [Notes 13-01-2021](2021-01-13-FAB-notes.md)
- [Notes 27-01-2021](2021-01-27-FAB-notes.md)
- [Notes 10-02-2021](2021-02-10-FAB-notes.md)

## Users Group Notes

- [Notes 28-10-2020](2020-10-28-UG-Pilot-notes-session-1.md)
- [Notes 13-11-2020](2020-11-13-UG-Pilot-notes.md)
- [Notes 27-11-2020](2020-11-27-UG-Pilot-notes.md)
- [Notes 11-12-2020](2020-12-11-UG-Pilot-notes.md)
